<?xml version="1.0" encoding="UTF-8"?>
<xs:schema xmlns:xs="http://www.w3.org/2001/XMLSchema" elementFormDefault="qualified">
  <xs:element name="corpus">
    <xs:complexType>
      <xs:sequence>
        <xs:element maxOccurs="unbounded" ref="s"/>
      </xs:sequence>
    </xs:complexType>
  </xs:element>
  <xs:element name="s" type="xs:string"/>
</xs:schema>
